FY 2013,2/23/2013,2/20/2013,"Slone Builders, Inc., White Lake, MI 48386",Worker was killed when nail from a nail gun struck him in the eye.
FY 2013,2/23/2013,2/20/2013,"Tex-Lee Operating Company, Giddings, TX 78942",Oil rig worker killed when a counter-weight fell 65 feet on him during a rig shutdown.
FY 2013,2/23/2013,2/21/2013,"Best Logging, Rock Castle, WV 25245",Employee killed by a falling tree during tree felling operations.
FY 2013,2/23/2013,2/21/2013,"Desert Cab, Inc., Las Vegas, NV 89109",Taxi driver was killed after being struck from behind by another vehicle, causing the car to catch fire.
FY 2013,2/23/2013,2/22/2013,"Saddai Inc., Perth Amboy, NJ 08861",Employee was struck and killed by vehicle while making a delivery.
FY 2013,3/2/2013,2/18/2013,"Cat Spec Ltd., Ardmore, OK 73402",Employee died while working in a confined space at a crude oil refinery.
FY 2013,3/2/2013,2/19/2013,"JJ's Restaurant, Kansas City, MO 64112",Employee killed in a natural gas explosion.
FY 2013,3/2/2013,2/21/2013,"Donald L. Shirey Lumber Company Inc, Rimersburg, PA 16248",Worker struck and killed by falling tree.
FY 2013,3/2/2013,2/22/2013,"Hagel Metal Fabrication Inc., East Peoria, IL",Worker operating laser machine struck and killed by metal debris.
FY 2013,3/2/2013,2/23/2013,"RSI Home Products Manufacturing, Inc., Lincolnton, NC  28092",Worker killed after being caught in saw machine at cabinetry facility.
FY 2013,3/2/2013,2/24/2013,"Turner Specialty Services LLC, Darrow, LA 70725",Employee crushed and killed by conveyor belt rollers undergoing maintenance.
FY 2013,3/2/2013,2/25/2013,"CSC Sugar LLC, Fairless Hills, PA 19030",Employee killed after falling into a sugar hopper.
FY 2013,3/2/2013,2/25/2013,"J.G. Boswell Company, Bakersfield, CA 93311",Worker drowned after accident caused vechicle to land in canal.
FY 2013,3/2/2013,2/25/2013,"Pete Gould & Sons Inc., Ellenboro, WV 26346",Employee struck and killed by falling tree.
FY 2013,3/2/2013,2/25/2013,"Sidewinder Drilling, Carrollton, OH 44615",Worker killed when struck by drilling equipment.
FY 2013,3/2/2013,2/26/2013,"Gilles & Audrey FleuryTrust, Anaheim, CA 92802",Worker died after falling 14 feet to concrete on construction site.
FY 2013,3/2/2013,2/27/2013,"Asplundh Tree Expert Co., Charlotte, NC  28217",Worker struck and killed by falling tree.
FY 2013,3/2/2013,3/1/2013,"CR&R, Inc., Stanton, CA  90680",Worker struck and killed by a projectile while welding.
FY 2013,3/2/2013,3/1/2013,"GB Auctions, Inc., Spokane, WA 99219",Worker died of CO poisoning emitted after gas-powered generator used inside trailer failed.